{"schema_version":"1.3.0","release_id":"2026-presidente-20261029T023119Z","election_id":"2026-presidente","status":"ready","validation_status":"passed","location":{"municipio_tse":"70718","uf":"SP","name":"SANTOS","display_name":"Santos"},"finalists":[{"slot":"A","number":"13","name":"LUIZ INÁCIO LULA DA SILVA","round_1_votes":98538,"round_2_votes":126438,"delta_votes":27900},{"slot":"B","number":"22","name":"FLAVIO NANTES BOLSONARO","round_1_votes":125561,"round_2_votes":137805,"delta_votes":12244}],"totals":{"round_1":{"eligible":348832,"turnout":263935,"abstention":84897,"valid":252290,"other":28191,"blank":4535,"null":7110,"invalid":11645},"round_2":{"eligible":348828,"turnout":273933,"abstention":74895,"valid":264243,"other":0,"blank":3210,"null":6480,"invalid":9690}},"accounting":{"other_round_1":28191,"delta_turnout":9998,"delta_invalid":-1955,"delta_valid":11953,"delta_finalists":40144,"identity_residual":0,"scope":"all_sections","evidence_type":"observed"},"coverage":{"sections_total":1076,"sections_installed":1076,"units_in_transition_analysis":1068,"eligible_share_used":0.9948},"display_notes":[]}
